{
  "schema": "webz/public-field/v0",
  "profile": "inspection-only-001",
  "observedOn": "2026-10-09",
  "laws": [
    "THE WEB IS A PORCH, NOT THE HOUSE",
    "VISIBLE DOOR != AUTHORITY",
    "DOOR != EFFECT",
    "CLICK != ADMISSION",
    "LINK != CROSSING",
    "CODE EXISTS != SERVICE EXISTS",
    "CI GREEN != PUBLIC DEPLOYMENT",
    "DEPLOYABLE != DEPLOYED",
    "RELATION != AUTHORITY",
    "PUBLIC SOURCE != PUBLIC CAPABILITY",
    "HOLD != FAILURE",
    "UNKNOWN != DENIED",
    "FILE != UPLOAD",
    "WEBZ != RADIO PLAYER",
    "WEBZ != BROADCASTER",
    "WEBZ != STATION",
    "WEB VISIBILITY != MACHINE CAPABILITY",
    "EXECUTOR EXISTS != PUBLIC EXECUTION SERVICE",
    "SOURCE != EXECUTION",
    "PROPOSAL != ADMISSION"
  ],
  "worlds": [
    {
      "id": "sanctuary-orchard",
      "label": "Sanctuary & Orchard",
      "shortDescription": "Two small worlds, each with its own door. Enter, remain, and return with nothing carried.",
      "category": "ENTER",
      "ownerSystem": "webZ",
      "ownerRepo": [
        "the-static-collective/webZ"
      ],
      "source": {
        "repository": "the-static-collective/webZ",
        "ref": "refs/heads/feat/static-pressing-001",
        "exactCommit": "1ad3bfd5d2429ec36f843818ac6f5bbde401e177",
        "observedContract": "Static local Sanctuary/Orchard navigation, invitation rehearsal, file hashing and proof inspection; no delivery."
      },
      "additionalSources": [],
      "state": "LOCAL_ONLY",
      "current": "Static local worlds. Public hosting is not observed.",
      "publicSurface": {
        "mode": "LOCAL_ROUTE",
        "target": "worlds/sanctuary/",
        "deploymentEvidence": null,
        "adoption": "NOT_CLAIMED"
      },
      "doors": [
        {
          "doorId": "enter-sanctuary",
          "label": "Enter Sanctuary",
          "kind": "LOCAL",
          "effectClass": "LOCAL_NAVIGATION",
          "target": "worlds/sanctuary/",
          "owner": "webZ",
          "availability": "AVAILABLE",
          "reason": "Explicit local choice only.",
          "requiredNextAuthority": "No additional authority for local inspection."
        },
        {
          "doorId": "enter-orchard",
          "label": "Enter Orchard",
          "kind": "LOCAL",
          "effectClass": "LOCAL_NAVIGATION",
          "target": "worlds/orchard/",
          "owner": "webZ",
          "availability": "AVAILABLE",
          "reason": "Explicit local choice only.",
          "requiredNextAuthority": "No additional authority for local inspection."
        }
      ],
      "authoritySummary": "Navigation records optional unsigned observations; it grants no sovereign crossing.",
      "nextGate": "Any consequential crossing requires independent owner admission.",
      "laws": [
        "THE WEB IS A PORCH, NOT THE HOUSE",
        "VISIBLE DOOR != AUTHORITY",
        "CLICK != ADMISSION",
        "LINK != CROSSING"
      ]
    },
    {
      "id": "invitation-porch",
      "label": "Invitation porch",
      "shortDescription": "Offer a small piece of public text and rehearse a separate human choice for each world.",
      "category": "MAKE",
      "ownerSystem": "webZ",
      "ownerRepo": [
        "the-static-collective/webZ"
      ],
      "source": {
        "repository": "the-static-collective/webZ",
        "ref": "refs/heads/feat/static-pressing-001",
        "exactCommit": "1ad3bfd5d2429ec36f843818ac6f5bbde401e177",
        "observedContract": "Static local Sanctuary/Orchard navigation, invitation rehearsal, file hashing and proof inspection; no delivery."
      },
      "additionalSources": [
        {
          "repository": "the-static-collective/webZ",
          "ref": "refs/pull/4/head",
          "exactCommit": "8153c60393e4e206160b284082f7eb3161d3f379",
          "observedContract": "Signed invitation and native response preflight; no authenticated delivery edge."
        }
      ],
      "state": "PROPOSAL_ONLY",
      "current": "Local invitation rehearsal. Neighboring signed preflight is inspectable source, not installed here.",
      "publicSurface": {
        "mode": "LOCAL_ROUTE",
        "target": "porch/",
        "deploymentEvidence": null,
        "adoption": "NOT_CLAIMED"
      },
      "doors": [
        {
          "doorId": "porch-rehearsal",
          "label": "Visit the invitation porch",
          "kind": "LOCAL",
          "effectClass": "LOCAL_PROPOSAL",
          "target": "porch/",
          "owner": "webZ",
          "availability": "AVAILABLE",
          "reason": "Explicit local choice only.",
          "requiredNextAuthority": "No additional authority for local inspection."
        },
        {
          "doorId": "porch-delivery",
          "label": "Deliver an invitation",
          "kind": "CAPABILITY",
          "effectClass": "REMOTE_EFFECT",
          "target": null,
          "owner": "Receiving world owner",
          "availability": "HOLD",
          "reason": "No authenticated delivery edge or independent receiving configuration exists here.",
          "requiredNextAuthority": "Separate reviewed authenticated edge and actual owner consent."
        }
      ],
      "authoritySummary": "Local HOLD, REFUSE and ADMIT are unsigned rehearsals; no delivery or publication.",
      "nextGate": "An actual encounter needs protected independent signers, receiving journals and an authenticated edge.",
      "laws": [
        "CLICK != ADMISSION",
        "SOURCE != EXECUTION",
        "PROPOSAL != ADMISSION"
      ]
    },
    {
      "id": "static-pressing",
      "label": "Bring one thing",
      "shortDescription": "Keep the source. Prepare a local request for a manga card, micro-zine, lyric object, machine-readable page, or surprise.",
      "category": "MAKE",
      "ownerSystem": "webZ",
      "ownerRepo": [
        "the-static-collective/webZ"
      ],
      "source": {
        "repository": "the-static-collective/webZ",
        "ref": "refs/heads/feat/static-pressing-001",
        "exactCommit": "1ad3bfd5d2429ec36f843818ac6f5bbde401e177",
        "observedContract": "Static local Sanctuary/Orchard navigation, invitation rehearsal, file hashing and proof inspection; no delivery."
      },
      "additionalSources": [],
      "state": "PROPOSAL_ONLY",
      "current": "Local preparation only. Potential return families are requests, never delivered outputs.",
      "publicSurface": {
        "mode": "LOCAL_ROUTE",
        "target": "press/",
        "deploymentEvidence": null,
        "adoption": "NOT_CLAIMED"
      },
      "doors": [
        {
          "doorId": "press-prepare",
          "label": "Prepare a pressing",
          "kind": "LOCAL",
          "effectClass": "LOCAL_PROPOSAL",
          "target": "press/",
          "owner": "webZ",
          "availability": "AVAILABLE",
          "reason": "Explicit local choice only.",
          "requiredNextAuthority": "No additional authority for local inspection."
        },
        {
          "doorId": "press-deliver",
          "label": "Deliver a return",
          "kind": "CAPABILITY",
          "effectClass": "REMOTE_EFFECT",
          "target": null,
          "owner": "Future independently admitted producer",
          "availability": "HOLD",
          "reason": "No producer crossing, upload, publication or payment is connected.",
          "requiredNextAuthority": "Separate source consent, producer admission and return contract."
        }
      ],
      "authoritySummary": "A file stays in the browser session; only label, type, length and hash enter the proposal.",
      "nextGate": "A separately reviewed producer may later receive an explicitly consented source; none is connected.",
      "laws": [
        "FILE != UPLOAD",
        "SOURCE != EXECUTION",
        "PROPOSAL != ADMISSION"
      ]
    },
    {
      "id": "crossing-evidence",
      "label": "Crossing evidence",
      "shortDescription": "Inspect public signed evidence and see which parts of the crossing remain unobserved.",
      "category": "CROSS",
      "ownerSystem": "webZ",
      "ownerRepo": [
        "the-static-collective/webZ"
      ],
      "source": {
        "repository": "the-static-collective/webZ",
        "ref": "refs/heads/feat/static-pressing-001",
        "exactCommit": "1ad3bfd5d2429ec36f843818ac6f5bbde401e177",
        "observedContract": "Static local Sanctuary/Orchard navigation, invitation rehearsal, file hashing and proof inspection; no delivery."
      },
      "additionalSources": [],
      "state": "INSPECTABLE",
      "current": "Read-only local verifier. The Constellation Rack remains locked.",
      "publicSurface": {
        "mode": "LOCAL_ROUTE",
        "target": "proof/",
        "deploymentEvidence": null,
        "adoption": "NOT_CLAIMED"
      },
      "doors": [
        {
          "doorId": "proof-inspect",
          "label": "Inspect crossing evidence",
          "kind": "LOCAL",
          "effectClass": "PROOF_INSPECTION",
          "target": "proof/",
          "owner": "webZ",
          "availability": "AVAILABLE",
          "reason": "Explicit local choice only.",
          "requiredNextAuthority": "No additional authority for local inspection."
        },
        {
          "doorId": "rack-unlock",
          "label": "Open the Constellation Rack",
          "kind": "CAPABILITY",
          "effectClass": "REMOTE_EFFECT",
          "target": null,
          "owner": "MAXHINAL / Human-Witness",
          "availability": "HOLD",
          "reason": "Independent histories, actual transport and exact original specimen remain unobserved here.",
          "requiredNextAuthority": "Source-owned genuine two-host proof and separate trusted acquisition design."
        }
      ],
      "authoritySummary": "Signature consistency is inspectable; imported records cannot grant LIVE or execution.",
      "nextGate": "Independently acquire exact source and both owner histories through the source-owned proof gate.",
      "laws": [